<?xml version="1.0" encoding="utf-8"?>
<!-- ===================================================================== -->
<!--
 * This file is part of CARDAMOM (R) which is jointly developed by THALES
 * and SELEX-SI. It is derivative work based on PERCO Copyright (C) THALES
 * 2000-2003. All rights reserved.
 * 
 * Copyright (C) THALES 2004-2005. All rights reserved
 * 
 * CARDAMOM is free software; you can redistribute it and/or modify it
 * under the terms of the GNU Library General Public License as published
 * by the Free Software Foundation; either version 2 of the License, or
 * (at your option) any later version.
 * 
 * CARDAMOM is distributed in the hope that it will be useful, but WITHOUT
 * ANY WARRANTY; without even the implied warranty of MERCHANTABILITY or
 * FITNESS FOR A PARTICULAR PURPOSE. See the GNU Library General Public
 * License for more details.
 * 
 * You should have received a copy of the GNU Library General Public
 * License along with CARDAMOM; see the file COPYING. If not, write to the
 * Free Software Foundation, Inc., 675 Mass Ave, Cambridge, MA 02139, USA.
-->
<!-- ===================================================================== -->

<!--Cdmw deployment file for validation test:-->
<!--Cdmw Repository launched with traces enabled-->
<!--...-->
<!--...-->
<!DOCTYPE System SYSTEM "CdmwPlatformMngtSystem.dtd">

<!-- ***************** -->
<!-- System definition -->
<!--                   -->
<!-- ***************** -->
<System Name="system_deployment" Port="21869">

    <!-- Default timeouts for processes of the entire system -->
    <Timeout Init="30000" Run="10000" Stop="10000"/>

    <!-- Default monitorings for the entire system -->
    <Host-monitoring Pull-interval="1000" Pull-timeout="1500"/>
    <App-monitoring  Pull-interval="060" Pull-timeout="070"/>
    <Proc-monitoring Model="NO_MONITORING"
                     Pull-interval="021" Pull-timeout="031"
                     Push-interval="041" Push-timeout="051"/>

    <!-- Services of the system -->
    <Service Name="NamingAndRepositoryService"
             App-name="CdmwServices"
             Process-name="Repository"/>

    <Service Name="XMLService"
             App-name="CdmwServices"
             Process-name="XML"/>

    <!-- Hosts of the system -->
    <Host Name="@hostname1val@"
          App-exec-path="cdmw_platform_application"
          Agent-exec-path="cdmw_platform_agent"/>

    <Host Name="@hostname2val@"
          App-exec-path="cdmw_platform_application"
          Agent-exec-path="cdmw_platform_agent"/>

    <!-- ********************** -->
    <!-- Application definition -->
    <!--                        -->
    <!-- ********************** -->
    <Application Name="CdmwServices"
                 Host-name="@hostname1val@"
                 Agent-port="-1"
                 App-port="-1">

        <!-- Default timeouts for processes of this application 
        <Timeout Init="20000" Run="20000" Stop="20000"/>
        -->

        <!-- Monitoring of this application -->
        <App-monitoring Pull-interval="021" Pull-timeout="031"/>


        <!-- ******************* -->
        <!-- Process definitions -->
        <!--                     -->
        <!-- ******************* -->
        <Managed-process Name="Repository"
                         Host-name="@hostname1val@"
                         Type="SERVICE-PROVIDER"
                         Autoended="FALSE"
                         Exec-path="cdmw_naming_and_repository" 
                         Args="--id=GlobalRepository --conf=cdmw_nar_integ_xms.xml --trace" 
                         Port="22456">
            <Init-step Name="initialisation" Timeout="30000"/>
        <!--    <Run-timeout Timeout="10000"/>
            <Stop-timeout Timeout="10000"/>  -->
        </Managed-process>

        <Managed-process Name="XML"
                         Host-name="@hostname1val@"
                         Type="SERVICE-PROVIDER"
                         Autoended="FALSE"
                         Exec-path="cdmw_xml_server.sh"
                         Args="--doctypedir=. --validate"
                         Port="-1">
            <Init-step Name="initialisation" Timeout="30000"/>
        <!--    <Run-timeout Timeout="1000"/>
            <Stop-timeout Timeout="2000"/> -->
        </Managed-process>
        
        <Init-graph>
            <Graph-element Name="Repository">
                <Graph-element-successor Name="XML"/>
            </Graph-element>
            
            <Graph-element Name="XML"/>
                        
            <Graph-element-root Name="Repository"/>
        </Init-graph>
 
        <Stop-graph>
            <Graph-element Name="XML">
                <Graph-element-successor Name="Repository"/>
            </Graph-element>
            <Graph-element Name="Repository"/>

            <Graph-element-root Name="XML"/>
        </Stop-graph>
        
    </Application>

    <Application Name="XMLValidation"
                 Host-name="@hostname2val@"
                 Agent-port="-1"
                 App-port="-1">

        <!-- Default timeouts for processes of this application -->
       <!-- <Timeout Init="20000" Run="20000" Stop="20000"/> -->

        <!-- Monitoring of this application -->
        <App-monitoring Pull-interval="021" Pull-timeout="031"/> 

        <Managed-process Name="TestClient"
                         Host-name="@hostname2val@"
                         Type="MANAGED-PROCESS"
                         Autoended="FALSE"
                         Exec-path="xml_service_test_client.sh"
                         Port="24010"
                         Args="">
            <Init-step Name="initialisation" Timeout="30000"/>
        <!--    <Run-timeout Timeout="1000"/>
            <Stop-timeout Timeout="2000"/> -->
        </Managed-process>
                          
        <Init-graph>
            <Graph-element Name="TestClient"/>
            <Graph-element-root Name="TestClient"/>
        </Init-graph>
        
        <Stop-graph>
            <Graph-element Name="TestClient"/>
            <Graph-element-root Name="TestClient"/>
        </Stop-graph>

    </Application>

    <!-- ****************************** -->
    <!--                                -->
    <!-- End of application definitions -->
    <!-- ****************************** -->

    <!-- Init graph of applications of the system-->
    <Init-graph>
        <Graph-element Name="CdmwServices"> 
            <Graph-element-successor Name="XMLValidation"/>
        </Graph-element>
        
        <Graph-element Name="XMLValidation"/> 

        <Graph-element-root Name="CdmwServices"/> 
    </Init-graph>

<!-- ************************ -->
<!--                          -->
<!-- End of system definition -->
<!-- ************************ -->
</System>

