<?xml version="1.0" encoding="utf-8"?>
<!-- ===================================================================== -->
<!--
 * This file is part of CARDAMOM (R) which is jointly developed by THALES
 * and SELEX-SI. It is derivative work based on PERCO Copyright (C) THALES
 * 2000-2003. All rights reserved.
 * 
 * Copyright (C) THALES 2004-2005. All rights reserved
 * 
 * CARDAMOM is free software; you can redistribute it and/or modify it
 * under the terms of the GNU Library General Public License as published
 * by the Free Software Foundation; either version 2 of the License, or
 * (at your option) any later version.
 * 
 * CARDAMOM is distributed in the hope that it will be useful, but WITHOUT
 * ANY WARRANTY; without even the implied warranty of MERCHANTABILITY or
 * FITNESS FOR A PARTICULAR PURPOSE. See the GNU Library General Public
 * License for more details.
 * 
 * You should have received a copy of the GNU Library General Public
 * License along with CARDAMOM; see the file COPYING. If not, write to the
 * Free Software Foundation, Inc., 675 Mass Ave, Cambridge, MA 02139, USA.
-->
<!-- ===================================================================== -->


<!DOCTYPE System SYSTEM "CdmwPlatformMngtSystem.dtd">

<!-- ***************** -->
<!-- System definition -->
<!--                   -->
<!-- ***************** -->
<System Name="validation" Port="21869">

    <!-- Default timeouts for processes of the entire system -->
    <Timeout Init="20000" Run="20000" Stop="20000"/>

    <!-- Default monitorings for the entire system -->
    <Host-monitoring Pull-interval="10000" Pull-timeout="3000"/>
    <App-monitoring  Pull-interval="0" Pull-timeout="0"/>
    <Proc-monitoring Model="NO_MONITORING"
                     Pull-interval="0" Pull-timeout="0"
                     Push-interval="0" Push-timeout="0"/>

    <!-- Services of the system -->
    <Service Name="NamingAndRepositoryService"
             App-name="CdmwServices"
             Process-name="Repository"/>


    <!-- Hosts of the system -->
    <Host Name="@hostname1val@"
          App-exec-path="cdmw_platform_application"
          Agent-exec-path="cdmw_platform_agent"/>
    <Host Name="@hostname2val@"
          App-exec-path="cdmw_platform_application"
          Agent-exec-path="cdmw_platform_agent"/>
    <Host Name="@hostname3val@"
          App-exec-path="cdmw_platform_application"
          Agent-exec-path="cdmw_platform_agent"/>

    <!-- ********************** -->
    <!-- Application definition -->
    <!--                        -->
    <!-- ********************** -->
    <Application
                 Name="CdmwServices"
                 Host-name="@hostname1val@"
                 Agent-port="-1"
                 App-port="-1">

        <Managed-process
                         Name="Repository"
                         Host-name="@hostname1val@"
                         Type="SERVICE-PROVIDER"
                         Autoended="FALSE"
                         Exec-path="cdmw_naming_and_repository"
                         Args="--CdmwProcessPort=42561 --CdmwLocalisationService=42562 --id=GlobalRepository --conf=cdmw_nar_integ.xml"
                         Port="-1">
            <Init-step Name="initialisation"/>
        </Managed-process>

        <!-- Init graph of processes of this application -->
        <Init-graph>
            <Graph-element Name="Repository"/>

            <Graph-element-root Name="Repository"/>
        </Init-graph>

        <!-- ***************************** -->
        <!--                               -->
        <!-- End of application definition -->
        <!-- ***************************** -->
    </Application>


    <!-- ************************************* -->
    <!-- Application definitions of the system -->
    <!--                                       -->
    <!-- ************************************* -->
    <Application
                 Name="APPL1"
                 Host-name="@hostname2val@"
                 Agent-port="21874"
                 App-port="-1">

        <!-- Default timeouts for processes of the entire system -->
        <Timeout Init="20000" Run="20000" Stop="20000"/>

        <Managed-process
                         Name="observer"
                         Host-name="@hostname2val@"
                         Type="MANAGED-PROCESS"
                         Autoended="FALSE"
                         Exec-path="cdmw_perf_daemon"
                         Args=" --CdmwXMLFile=V-SMG-022-data/TestPerfDaemon.xml --validateXML --observer --nb-test=100 --limit-time=150 --in-percent-case=95 --supervision=corbaloc::@hostname1val@:21871/CdmwPlatformMngtSupervision"
                         Port="-1">
            <Init-step Name="step0"/>
        </Managed-process>

		<Init-graph>
		    <Graph-element Name="observer"/>
			<Graph-element-root Name="observer"/>
    	</Init-graph>
   </Application>


    <Application
                 Name="APPL2"
                 Host-name="@hostname3val@"
                 Agent-port="21875"
                 App-port="-1">

        <!-- Default timeouts for processes of the entire system -->
        <Timeout Init="20000" Run="20000" Stop="20000"/>

        <Managed-process
                         Name="killer"
                         Host-name="@hostname3val@"
                         Type="MANAGED-PROCESS"
                         Autoended="TRUE"
                         Exec-path="cdmw_killer.sh"
                         Args=" --CdmwXMLFile=V-SMG-022-data/TestPerfDaemon.xml --validateXML"
                         Port="-1">
            <Init-step Name="step0"/>
        </Managed-process>              
		<Init-graph>
		    <Graph-element Name="killer"/>
			<Graph-element-root Name="killer"/>
    	</Init-graph>    
    </Application>


    <!-- Init graph of applications of the system-->
    <Init-graph>
        <Graph-element Name="CdmwServices"> 
            <Graph-element-successor Name="APPL1"/>
        </Graph-element>
         <Graph-element Name="APPL1"> 
            <Graph-element-successor Name="APPL2"/>
        </Graph-element>
        <Graph-element-root Name="CdmwServices"/>
    </Init-graph>

    
    <!-- ************************ -->
    <!--                          -->
    <!-- End of system definition -->
    <!-- ************************ -->
</System>

