<?xml version="1.0" encoding="utf-8"?>
<!--
 * =========================================================================== *
 * This file is part of CARDAMOM (R) which is jointly developed by THALES
 * and SELEX-SI.
 * 
 * It is derivative work based on PERCO Copyright (C) THALES 2000-2003.
 * All rights reserved.
 * 
 * CARDAMOM is free software; you can redistribute it and/or modify it under
 * the terms of the GNU Library General Public License as published by the
 * Free Software Foundation; either version 2 of the License, or (at your
 * option) any later version.
 * 
 * CARDAMOM is distributed in the hope that it will be useful, but WITHOUT
 * ANY WARRANTY; without even the implied warranty of MERCHANTABILITY or
 * FITNESS FOR A PARTICULAR PURPOSE. See the GNU Library General Public
 * License for more details.
 * 
 * You should have received a copy of the GNU Library General
 * Public License along with CARDAMOM; see the file COPYING. If not, write to
 * the Free Software Foundation, Inc., 675 Mass Ave, Cambridge, MA 02139, USA.
 * =========================================================================== *
-->


<!DOCTYPE System SYSTEM "CdmwPlatformMngtSystem.dtd">

<!-- ***************** -->
<!-- System definition -->
<!--                   -->
<!-- ***************** -->
<System Name="S1" Port="21869">

    <!-- Default timeouts for processes of the entire system -->
	<Timeout Init="20000" Run="20000" Stop="20000"/>

    <!-- Default monitorings for the entire system -->
	<Host-monitoring Pull-interval="1000" Pull-timeout="1500"/>
	<App-monitoring  Pull-interval="1000" Pull-timeout="1000"/>
    <Proc-monitoring Model="NO_MONITORING"
                     Pull-interval="0" Pull-timeout="0"
                     Push-interval="0" Push-timeout="0"/>

    <!-- Run sets of the system -->
    <Run-set Name="R1">
        <Run-set-element Name="A1"/>
        <Run-set-element Name="A2"/>
        <Run-set-element Name="A2"/>
    </Run-set>

<!-- ************************ -->
<!--                          -->
<!-- End of system definition -->
<!-- ************************ -->
</System>

